{
  "$schema": "https://scheme-tokens.dev/schemas/token-layer.v1.schema.json",
  "kind": "scheme-tokens/token-layer",
  "formatVersion": 2,
  "id": "application",
  "defaultVisibility": "public",
  "tokens": {
    "card.background": {
      "value": {
        "ref": "brand.primary"
      }
    }
  }
}
